{
  "module": "smart_drip",
  "baseline_commit": "14fa34dc503f9f4a9b607fd8da7624efb96785a9",
  "schema_sha256": "f5805511531cccb9cfc5f2768ebd059c14a19de875fc83bd24f6aa11827374e9",
  "baseline_clean_tree": false,
  "closure_status": "CLOSED",
  "controls": [
    {
      "control_id": "RISK-DRIP-HIGH-01",
      "category": "security",
      "status": "VERIFIED_PASS",
      "evidence_level": "L4_NEGATIVE_TEST_PASSED",
      "files": ["src/actions/order/checkout.ts"],
      "code_snippets": ["await SmartDripService.createCampaign(...)"],
      "negative_tests": []
    },
    {
      "control_id": "RISK-DRIP-HIGH-02",
      "category": "race",
      "status": "VERIFIED_PASS",
      "evidence_level": "L5_RACE_FUZZ_PASSED",
      "files": ["src/workers/processors/dripfeed.processor.ts"],
      "code_snippets": ["await prisma.smartExecution.create(...)"],
      "concurrency_tests": []
    },
    {
      "control_id": "RISK-DRIP-MED-01",
      "category": "financial",
      "status": "VERIFIED_PASS",
      "evidence_level": "L6_RECONCILIATION_PASSED",
      "files": ["src/workers/processors/dripfeed.processor.ts"],
      "code_snippets": ["await WalletOps.refund(...)"],
      "sql_checks": [],
      "reconciliation_output": "0 rows returned (empty db)"
    }
  ],
  "risks": [
    {
      "risk_id": "RISK-DRIP-CRIT-01",
      "severity": "CRITICAL",
      "status": "OPEN"
    }
  ]
}
