{
  "module": "commission",
  "baseline_commit": "14fa34dc503f9f4a9b607fd8da7624efb96785a9",
  "schema_sha256": "f5805511531cccb9cfc5f2768ebd059c14a19de875fc83bd24f6aa11827374e9",
  "baseline_clean_tree": true,
  "closure_status": "CLOSED",
  "controls": [
    {
      "control_id": "FIN-COMM-01",
      "category": "financial",
      "status": "VERIFIED_PASS",
      "evidence_level": "L6_RECONCILIATION_PASSED",
      "files": ["src/services/loyalty.ts"],
      "code_snippets": ["await tx.commission.create()"]
    }
  ]
}
